{"task_id":"jacobian/public-reproductions-v1-reliability-triangle-fair","conclusion":"TRUE","result":{"probability":{"num":"5","den":"8"},"states":8},"claimed_assurance":"COMPUTED","scope":"jacobian/public-reproductions-v1-reliability-triangle-fair complete finite input","completeness":"COMPLETE","evidence":[{"path":"evidence/answer.txt","sha256":"sha256:f6f94ea9c3f487fc4df414f30786b83798d9479ccaab9e2fe1e0c0370cc46bcc"}],"limitations":[]}